{
	"contractVersion": "1.0.0",
	"identity": "ix://agent-ix/assurance/mapping/artifact-markdown",
	"version": "1.0.0",
	"sourceType": "ix://agent-ix/assurance/type/Artifact",
	"targetType": "ix://agent-ix/assurance/type/Artifact",
	"representation": "markdown",
	"correspondences": [
		{
			"sourceIdentity": "ix://agent-ix/assurance/field/artifact-id",
			"targetLocus": "frontmatter.id"
		},
		{
			"sourceIdentity": "ix://agent-ix/assurance/field/summary",
			"targetLocus": "heading:Summary/body"
		}
	],
	"transformation": {
		"kind": "lens",
		"purity": "pure",
		"deterministic": true,
		"externalReads": [],
		"externalWrites": [],
		"failureStates": ["invalid", "unsupported", "lossy"],
		"retryIdempotent": true,
		"preservation": "semantic-lossless",
		"getPutLaws": ["get-put", "put-get", "put-put"],
		"conflictPolicy": "reject"
	}
}
